СОЦИАЛЬНО-ЭКОНОМИЧЕСКИЕ ПОКАЗАТЕЛИ РОССИЙСКОЙ ФЕДЕРАЦИИ В 1991-2018 гг.;;;;;;;;;;;;;;;;;;;;;;;;;;;;
 ПОКАЗАТЕЛИ ;1991;1992;1993;1994;1995;1996;1997;1998;1999;2000;2001;2002;2003;2004;2005;2006;2007;2008;2009;2010;2011;2012;2013;2014;2015;2016;2017;2018
13. ОСНОВНЫЕ ФОНДЫ;;;;;;;;;;;;;;;;;;;;;;;;;;;;
Основные фонды на конец  года по полной учетной стоимости1), млн руб. (до 1997 г. - млрд руб.);2061;43215;63861;1221494;5306460;13250160;13419951;14277540;14334783;17464772;21495236;26333273;32173286;34873724;41493568;47489498;60391454;74441095;82302969;93185612;108001247;121268908;133521531;147429656;160725261;183403693;194649464;210940524
Основные фонды государственной формы собственности на конец года по полной учетной стоимости2), млн руб.(до 1997 г. - млрд руб.);1875;11106;16795;368891;1491115;3776296;3757586;3854936;3927730;4366043;5588761;7109984;7399856;8020957;9543521;10447690;14493949;15632630;16460594;20500835;23760274;26679160;28039522;32434524;35359557;42182849;42822882;48554819
Основные фонды негосударственной формы собственности на конец года по полной учетной стоимости2), млн руб. (до 1997 г. - млрд руб.);186;32109;47066;852603;3815345;9473864;9662365;10422604;10407053;13098729;15906475;19223289;24773430;26852767;31950047;37041808;45897505;58808465;65842375;72684777;84240973;94589748;105482009;114995132;125365704;141220844;151826582;162385705
Ввод в действие основных фондов, млн руб. (до 1997 г. - млрд руб.);175;2005;15093;72350;230407;334302;406472;428564;597306;843378;1117655;1615063;1815658;1972112;2943686;3252436;4296411;5744847;6356223;6275935;8813314;10338476;11160485;10887946;10721081;13256290;12484066;14907930
"Основные фонды на конец  года по полной учетной стоимости по видам экономической деятельности 1);3), млн руб. (до 1997 г.- млрд руб.)";2061;43215;63861;1221494;5306460;13250160;13419951;14277540;14334783;17464772;21495236;26333273;32173286;34873724;41493568;47489498;60391454;74441095;82302969;93185612;108001247;121268908;133521531;147429656;160725261;183403693;194649464;210940524
В соответствии с Общероссийским классификатором видов экономической деятельности ОК 029-2007 (Кдес Ред.1.1) ОКВЭД;;;;;;;;;;;;;;;;;;;;;;;;;;;;
сельское хозяйство, охота и лесное хозяйство;;;;;;;;;;;;;;1395777;1440084;1574699;1963327;2259571;2566917;2859877;3127209;3335020;3671833;3909034;4285130;4758488;;
рыболовство, рыбоводство;;;;;;;;;;;;;;56675;55139;59975;79318;91247;97356;113107;132742;143320;151434;148346;159828;187833;;
добыча полезных ископаемых;;;;;;;;;;;;;;2618033;3310147;4081090;4976884;6365455;7861116;9084573;10574297;12242237;14106953;15733599;18518184;21527321;;
обрабатывающие производства;;;;;;;;;;;;;;3196017;3639399;4218012;5122523;6001523;6951720;7989040;8876602;9862265;11378966;13550258;15099981;16437831;;
производство и распределение  электроэнергии, газа и воды;;;;;;;;;;;;;;3033503;3408329;3605984;4087407;4925292;5740995;6769064;8528539;9761425;10683775;11842165;12945288;14176714;;
строительство;;;;;;;;;;;;;;688936;604922;711286;992921;1220893;1391117;1499940;1499379;1581874;1676906;1774655;2049423;2084446;;
"оптовая и розничная торговля; ремонт автотранспортных средств, мотоциклов, бытовых изделий и предметов личного пользования";;;;;;;;;;;;;;618622;859421;1138375;1648977;2156539;2556150;3109800;3738919;3865272;4098898;4748032;4891493;5191935;;
гостиницы и рестораны;;;;;;;;;;;;;;244422;278036;298381;395761;443796;484662;535183;604325;626326;684460;739797;912288;1037844;;
транспорт и связь;;;;;;;;;;;;;;9836464;13388808;15270817;17942233;21525544;23283486;25950327;30736997;34648614;36179237;40301112;42493597;47611499;;
финансовая деятельность;;;;;;;;;;;;;;372276;493588;679710;996344;1446253;1858026;2154362;2070638;2518918;2603130;2734051;3082169;3372544;;
операции с недвижимым имуществом, аренда и  предоставление услуг;;;;;;;;;;;;;;8659798;9368932;10427578;13707183;18642465;19616695;21895792;25008183;28560221;33050658;36017036;38238321;43713159;;
"государственное управление и обеспечение военной безопасности; социальное страхование";;;;;;;;;;;;;;1061442;1237532;1612048;2853979;3260983;3538562;4253045;5364965;5785203;5941052;6004261;7098269;10829530;;
образование;;;;;;;;;;;;;;1210675;1278844;1410202;2337357;2468104;2534403;2700025;2924719;3266821;3535385;3807107;4023573;4292373;;
здравоохранение и предоставление социальных услуг;;;;;;;;;;;;;;940493;1023358;1154516;1639280;1833726;1965934;2175848;2372776;2651390;3054071;3273093;3528491;3944474;;
предоставление прочих коммунальных,социальных и персональных услуг;;;;;;;;;;;;;;940591;1107029;1246825;1647960;1799704;1855830;2095629;2440957;2420002;2704773;2847110;3399226;4237702;;
В соответствии с Общероссийским классификатором видов экономической деятельности ОК 029-2014 (КДЕС Ред.2) ОКВЭД2;;;;;;;;;;;;;;;;;;;;;;;;;;;;
сельское, лесное хозяйство, охота, рыболовство и рыбоводство;;;;;;;;;;;;;;;;;;;;;;;;;;;5791582;6462343
добыча полезных ископаемых;;;;;;;;;;;;;;;;;;;;;;;;;;;23924351;26953233
обрабатывающие производства;;;;;;;;;;;;;;;;;;;;;;;;;;;18956787;20814107
"обеспечение электрической энергией, газом и паром; кондиционирование воздуха";;;;;;;;;;;;;;;;;;;;;;;;;;;13721915;15489469
"водоснабжение; водоотведение, организация сбора и утилизации отходов, деятельность по ликвидации загрязнений";;;;;;;;;;;;;;;;;;;;;;;;;;;2700207;2939751
строительство;;;;;;;;;;;;;;;;;;;;;;;;;;;2191134;2718514
"торговля оптовая и розничная; ремонт автотранспортных средств и мотоциклов";;;;;;;;;;;;;;;;;;;;;;;;;;;4751445;5286645
транспортировка и хранение;;;;;;;;;;;;;;;;;;;;;;;;;;;43830807;47344412
деятельность гостиниц и предприятий общественного питания;;;;;;;;;;;;;;;;;;;;;;;;;;;1353002;1421923
деятельность в области информации и связи;;;;;;;;;;;;;;;;;;;;;;;;;;;5150353;5881378
деятельность финансовая и страховая;;;;;;;;;;;;;;;;;;;;;;;;;;;3821326;4604787
деятельность по операциям с недвижимым имуществом;;;;;;;;;;;;;;;;;;;;;;;;;;;38866126;39842029
деятельность профессиональная, научная и техническая;;;;;;;;;;;;;;;;;;;;;;;;;;;4784518;5136453
деятельность административная и сопутствующие дополнительные услуги;;;;;;;;;;;;;;;;;;;;;;;;;;;1975245;1791299
"осударственное управление и обеспечение военной безопасности; социальное обеспечение";;;;;;;;;;;;;;;;;;;;;;;;;;;11657732;12122636
образование;;;;;;;;;;;;;;;;;;;;;;;;;;;4807941;5220952
деятельность в области здравоохранения и социальных услуг;;;;;;;;;;;;;;;;;;;;;;;;;;;4054083;4347744
деятельность в области культуры, спорта, организации досуга и развлечений;;;;;;;;;;;;;;;;;;;;;;;;;;;1888338;2119910
предоставление прочих видов услуг;;;;;;;;;;;;;;;;;;;;;;;;;;;422572;442939
Степень износа основных фондов на конец года, в процентах;35,4;42,5;33,7;41,3;39,5;37,8;41,0;41,6;41,7;39,3;41,1;44,0;43,0;41,9;45,2;46,3;46,2;45,3;45,3;47,1;47,9;47,7;48,2;49,4;47,7;48,1;47,3;46,6
Удельный вес полностью изношенных основных фондов на конец года, в процентах от общего объема основных фондов4);;;7,5;11,4;9,5;9,9;10,9;11,5;11,9;12,7;13,6;17,1;15,0;14,8;13,3;13,3;12,9;13,1;13,0;13,5;14,4;14,0;14,6;14,9;15,8;16,9;17,9;18,7
"Коэффициент обновления основных фондов (в сопоставимых ценах)5);6), в процентах";5,5;3,6;2,5;2,1;1,9;1,6;1,4;1,3;1,4;1,8;2,1;2,2;2,5;2,7;3,0;3,3;4,0;4,4;4,1;3,7;4,6;4,8;4,6;4,3;3,9;4,4;4,3;4,7
"Коэффициент выбытия основных фондов (в сопоставимых ценах)5);6), в процентах ";2,1;1,6;1,9;2,0;1,9;1,7;1,6;1,4;1,2;1,3;1,3;1,3;1,2;1,1;1,1;1,0;1,0;1,0;1,0;0,8;0,8;0,7;0,7;0,8;1,0;0,8;0,7;0,7
"Индекс физического объема основных фондов (в сопоставимых ценах)5);7), в процентах к предыдущему году";103,5;102,0;100,6;99,9;100,1;99,9;99,6;99,7;100,2;100,5;100,9;101,0;101,3;101,6;101,9;102,4;103,1;103,6;103,2;103,0;104;104,3;104,1;103,7;103,2;103,9;103,8;104,2
1) С 2011 г. - с учетом переоценки, проведенной на конец года.;;;;;;;;;;;;;;;;;;;;;;;;;;;;
2) Начиная с 2010 г. данные уточнены, расчеты проведены по полному кругу организаций с учетом основных фондов Банка России и основных фондов, находящихся в государственной казне.;;;;;;;;;;;;;;;;;;;;;;;;;;;;
3) По видам экономической деятельности (по ОКВЭД) разработка показателей осуществляется с 2004 г.;;;;;;;;;;;;;;;;;;;;;;;;;;;;
4) По коммерческим организациям (без субъектов малого предпринимательства).;;;;;;;;;;;;;;;;;;;;;;;;;;;;
5) Cопоставимые цены 2000 г.;;;;;;;;;;;;;;;;;;;;;;;;;;;;
6) Данные за 2014 г. без учета сведений по Республике Крым и г.Севастополю.;;;;;;;;;;;;;;;;;;;;;;;;;;;;
7) В целях обеспечения статистической сопоставимости относительный показатель  по Российской Федерации за 2014 г. рассчитан без учета данных по Республике Крым и г. Севастополю.;;;;;;;;;;;;;;;;;;;;;;;;;;;;
